<?xml version="1.0" encoding="UTF-8"?>
<!DOCTYPE promozioni SYSTEM "promozioni.dtd">
<promozioni>
  <sconti>
    <sconto id="SC01" tipo="prodotto" valorePercento="20%" dal="2026-03-11" al="2026-03-20">
      <descrizione>saldi di primavera</descrizione>
      <applicazione>
        <idProdotto>S01</idProdotto>
      </applicazione>
    </sconto>
  </sconti>
  <bonus>
    <bonusterm id="BO01" tipo="personalizzato" crediti="1" dal="2026-03-11" al="2026-03-20">
      <descrizione>1 credito per ogni acquisto effettuato</descrizione>
      <applicazione>
        <criterio tipo="reputazione" valore="1"/>
      </applicazione>
    </bonusterm>
  </bonus>
</promozioni>
